"_id","id","description","options","probability","phase","translation.HI","image","audio.HI","title"
"ObjectId(""5fc3ef49660616e15361e157"")",7,"Your eyesight gets weaker","[{""id"":1,""description"":""Get an eye check-up done and buy spectacles (Needs ₹2500)"",""action"":{""expenditure"":0,""debt"":0,""current"":-2500,""events"":[]},""audio"":{""HI"":""event_7_option_1.mp3""},""translation"":{""HI"":""आंखों की जांच कराएं और चश्मा खरीदें| (₹2500 खर्च होंगे )""}},{""id"":2,""description"":""Ignore it"",""action"":{""expenditure"":0,""debt"":0,""current"":0,""events"":[]},""audio"":{""HI"":""event_7_option_2.mp3""},""translation"":{""HI"":""इसके बारे में कुछ नहीं करना है |""}}]",0.7,2,"आपकी आंखें कमज़ोर हो जाती हैं, ठीक से दिखाई नहीं देता |","event_7.png","event_7.mp3","Your eyesight gets weaker"
"ObjectId(""5fc3ef49660616e15361e158"")",30,"Your uncle sold some old family-owned land and you get a share of the money acquired","[{""id"":1,""description"":""Ok"",""action"":{""expenditure"":0,""debt"":0,""current"":500000,""events"":[]},""audio"":{""HI"":""event_30_option_1.mp3""},""translation"":{""HI"":""ठीक है""}}]",0.8,2,"आपके चाचा ने एक पुरानी जमीन बेची और आपको पैसों का एक हिस्सा मिलता है|","event_30.png","event_30.mp3","..."
"ObjectId(""5fc3ef49660616e15361e159"")",28,"Do you want to apply for the Atal Pension Yojana scheme?","[{""id"":1,""description"":""Yes (To get a monthly pension of ₹1000 on reaching age 60, will have to pay ₹116 per month until you turn 60)"",""action"":{""expenditure"":116,""debt"":0,""current"":0,""events"":[]},""audio"":{""HI"":""event_28_option_1.mp3""},""translation"":{""HI"":""हाँ (60 साल के हो जाने पर, हर महीने ₹1000 की पेंशन पाने के लिए, अभी आपको 60 साल की उम्र तक हर महीने ₹116 भरने होंगे)""}},{""id"":2,""description"":""Yes (To get a monthly pension of ₹2000 on reaching age 60, will have to pay ₹231 per month until you turn 60)"",""action"":{""expenditure"":231,""debt"":0,""current"":0,""events"":[]},""audio"":{""HI"":""event_28_option_2.mp3""},""translation"":{""HI"":""हाँ (60 साल के हो जाने पर, हर महीने ₹2000 की पेंशन पाने के लिए, अभी आपको 60 साल की उम्र तक हर महीने ₹231 भरने होंगे)""}},{""id"":3,""description"":""Yes (To get a monthly pension of ₹3000 on reaching age 60, will have to pay ₹347 per month until you turn 60)"",""action"":{""expenditure"":347,""debt"":0,""current"":0,""events"":[]},""audio"":{""HI"":""event_28_option_3.mp3""},""translation"":{""HI"":""हाँ (60 साल के हो जाने पर, हर महीने ₹3000 की पेंशन पाने के लिए, अभी आपको 60 साल की उम्र तक हर महीने ₹347 भरने होंगे)""}},{""id"":4,""description"":""No"",""action"":{""expenditure"":0,""debt"":0,""current"":0,""events"":[{""id"":29,""probability"":1}]},""audio"":{""HI"":""event_28_option_4.mp3""},""translation"":{""HI"":""नहीं""}}]",0,2,"क्या आप अटल पेंशन योजना के लिए अप्लाई करना चाहते हैं?","event_28.png","event_28.mp3","..."
"ObjectId(""5fc3ef49660616e15361e15a"")",5,"You get married. How much do you spend on the wedding from your end?","[{""id"":1,""description"":""Spend Rs 1 lakh, family members will take care of the rest"",""action"":{""expenditure"":0,""debt"":0,""current"":-100000,""events"":[]},""audio"":{""HI"":""event_5_option_1.mp3""},""translation"":{""HI"":""1 लाख रुपए खर्च करें, परिवार के अन्य सदस्य बाकी का खर्च संभालेंगे|""}},{""id"":2,""description"":""Spend Rs 1.5 lakh, family members will take care of the rest"",""action"":{""expenditure"":0,""debt"":0,""current"":-150000,""events"":[]},""audio"":{""HI"":""event_5_option_2.mp3""},""translation"":{""HI"":""1.5 लाख रुपए खर्च करें, परिवार के अन्य सदस्य बाकी का खर्च संभालेंगे|""}}]",0,2,"आपकी शादी होती है| आप अपनी ओर से शादी पर कितना खर्च करते हैं ?","event_5.png","event_5.mp3","You get married. How much do you spend on the wedding from your end?"
"ObjectId(""5fc3ef49660616e15361e15b"")",6,"You have kids. The family members living with you now include your parents, your spouse, and your kids.","[{""id"":1,""description"":""Ok"",""action"":{""expenditure"":2000,""debt"":0,""current"":0,""events"":[]},""audio"":{""HI"":""event_6_option_1.mp3""},""translation"":{""HI"":""ठीक है""}}]",1,2,"आपके बच्चे होते है | आपके साथ रहने वाले परिवार वालों में अब आपके माता-पिता, आपके जीवनसाथी, और आपके बच्चे शामिल हैं।","event_6.png","event_6.mp3","You have kids. The family members living with you now include your parents, your spouse, and your kids."
"ObjectId(""5fc3ef49660616e15361e15c"")",29,"Do you want to apply for the Atal Pension Yojana scheme?","[{""id"":1,""description"":""Yes (To get a monthly pension of ₹1000 on reaching age 60, will have to pay ₹291 per month until you turn 60)"",""action"":{""expenditure"":291,""debt"":0,""current"":0,""events"":[]},""audio"":{""HI"":""event_29_option_1.mp3""},""translation"":{""HI"":""हाँ (60 साल के हो जाने पर, हर महीने ₹1000 की पेंशन पाने के लिए, अभी आपको 60 साल की उम्र तक हर महीने ₹291 भरने होंगे)""}},{""id"":2,""description"":""Yes (To get a monthly pension of ₹2000 on reaching age 60, will have to pay ₹582 per month until you turn 60)"",""action"":{""expenditure"":582,""debt"":0,""current"":0,""events"":[]},""audio"":{""HI"":""event_29_option_2.mp3""},""translation"":{""HI"":""हाँ (60 साल के हो जाने पर, हर महीने ₹2000 की पेंशन पाने के लिए, अभी आपको 60 साल की उम्र तक हर महीने ₹582 भरने होंगे)""}},{""id"":3,""description"":""Yes (To get a monthly pension of ₹3000 on reaching age 60, will have to pay ₹873 per month until you turn 60)"",""action"":{""expenditure"":873,""debt"":0,""current"":0,""events"":[]},""audio"":{""HI"":""event_29_option_3.mp3""},""translation"":{""HI"":""हाँ (60 साल के हो जाने पर, हर महीने ₹3000 की पेंशन पाने के लिए, अभी आपको 60 साल की उम्र तक हर महीने ₹873 भरने होंगे)""}},{""id"":4,""description"":""No"",""action"":{""expenditure"":0,""debt"":0,""current"":0,""events"":[]},""audio"":{""HI"":""event_29_option_4.mp3""},""translation"":{""HI"":""नहीं""}}]",0,3,"क्या आप अटल पेंशन योजना के लिए अप्लाई करना चाहते हैं?","event_29.png","event_29.mp3","..."
"ObjectId(""5fc3ef49660616e15361e15d"")",27,"Do you want to apply for the Atal Pension Yojana scheme?","[{""id"":1,""description"":""Yes (To get a monthly pension of ₹1000 on reaching age 60, will have to pay ₹50 per month until you turn 60)"",""action"":{""expenditure"":50,""debt"":0,""current"":0,""events"":[]},""audio"":{""HI"":""event_27_option_1.mp3""},""translation"":{""HI"":""हाँ (60 साल के हो जाने पर, हर महीने ₹1000 की पेंशन पाने के लिए, अभी आपको 60 साल की उम्र तक हर महीने ₹50 भरने होंगे)""}},{""id"":2,""description"":""Yes (To get a monthly pension of ₹2000 on reaching age 60, will have to pay ₹100 per month until you turn 60)"",""action"":{""expenditure"":100,""debt"":0,""current"":0,""events"":[]},""audio"":{""HI"":""event_27_option_2.mp3""},""translation"":{""HI"":""हाँ (60 साल के हो जाने पर, हर महीने ₹2000 की पेंशन पाने के लिए, अभी आपको 60 साल की उम्र तक हर महीने ₹100 भरने होंगे)""}},{""id"":3,""description"":""Yes (To get a monthly pension of ₹3000 on reaching age 60, will have to pay ₹150 per month until you turn 60)"",""action"":{""expenditure"":150,""debt"":0,""current"":0,""events"":[]},""audio"":{""HI"":""event_27_option_3.mp3""},""translation"":{""HI"":""हाँ (60 साल के हो जाने पर, हर महीने ₹3000 की पेंशन पाने के लिए, अभी आपको 60 साल की उम्र तक हर महीने ₹150 भरने होंगे)""}},{""id"":4,""description"":""No"",""action"":{""expenditure"":0,""debt"":0,""current"":0,""events"":[{""id"":28,""probability"":1}]},""audio"":{""HI"":""event_27_option_4.mp3""},""translation"":{""HI"":""नहीं""}}]",1,1,"क्या आप अटल पेंशन योजना के लिए अप्लाई करना चाहते हैं?","event_27.png","event_27.mp3","..."