"_id","id","description","options","probability","phase","translation.HI","image","audio.HI","title"
"ObjectId(""5fc3ef49660616e15361e140"")",1,"You need to help pay for your younger brother's school fees. How much do you pay? (Other family members will pay the rest)","[{""id"":1,""description"":""Pay ₹2000"",""action"":{""expenditure"":0,""debt"":0,""current"":-2000,""events"":[]},""audio"":{""HI"":""event_1_option_1.mp3""},""translation"":{""HI"":""₹2000 भरें""}},{""id"":2,""description"":""Pay ₹5000"",""action"":{""expenditure"":0,""debt"":0,""current"":-5000,""events"":[]},""audio"":{""HI"":""event_1_option_2.mp3""},""translation"":{""HI"":""₹5000 भरें""}}]",0.6,1,"आपको अपने छोटे भाई के स्कूल की फीस भरने में मदद करनी है। आप कितने पैसे देते हैं? (परिवार के अन्य सदस्य बाकी की फीस भरेंगे)","event_1.png","event_1.mp3","You need to help pay for your younger brother's school fees. How much do you pay? (Other family members will pay the rest)"
"ObjectId(""5fc3ef49660616e15361e141"")",3,"You look for a place to stay in this new city. You have 2 options: Number 1. Rent Rs 4000 per month; shared with 2 other people; commuting will cost 20 Rs per day. Number 2. Rent Rs 2000 per month; shared with 4 other people; commuting will cost 40 Rs per day. Which option do you choose?","[{""id"":1,""description"":""Option 1"",""action"":{""expenditure"":4600,""debt"":0,""current"":0,""events"":[]},""audio"":{""HI"":""event_3_option_1.mp3""},""translation"":{""HI"":""विकल्प 1""}},{""id"":2,""description"":""Option 2"",""action"":{""expenditure"":3200,""debt"":0,""current"":0,""events"":[]},""audio"":{""HI"":""event_3_option_2.mp3""},""translation"":{""HI"":""विकल्प 2""}}]",0,1,"आप इस नए शहर में रहने के लिए जगह ढूँढ़ते हैं। आपके पास 2 विकल्प हैं | नंबर 1, हर महीने 4000 रुपये का किराया; 2 और लोगों के साथ रहना होगा; और आने-जाने का खर्च प्रतिदिन 20 रुपये होगा। नंबर 2, हर महीने 2000 रुपये का किराया; 4 और लोगों के साथ रहना होगा; और आने-जाने का खर्च प्रतिदिन 40 रुपये होगा। आप कौन सा विकल्प चुनते हैं?","event_3.png","event_3.mp3","You look for a place to stay in this new city. You have 2 options: Number 1. Rent Rs 4000 per month; shared with 2 other people; commuting will cost 20 Rs per day. Number 2. Rent Rs 2000 per month; shared with 4 other people; commuting will cost 40 Rs per day. Which option do you choose?"
"ObjectId(""5fc3ef49660616e15361e142"")",2,"You get a job offer in another city, with better pay. Do you accept the offer?","[{""id"":1,""description"":""Accept the offer"",""action"":{""expenditure"":0,""debt"":0,""current"":0,""events"":[{""id"":3,""probability"":1}]},""audio"":{""HI"":""event_2_option_1.mp3""},""translation"":{""HI"":""हाँ""}},{""id"":2,""description"":""Refuse"",""action"":{""expenditure"":0,""debt"":0,""current"":0,""events"":[]},""audio"":{""HI"":""event_2_option_2.mp3""},""translation"":{""HI"":""नहीं""}}]",0.7,1,"आपको बेहतर तनख़्वाह के साथ दूसरे शहर में नौकरी का प्रस्ताव मिलता है। क्या आप प्रस्ताव स्वीकार करते हैं?","event_2.png","event_2.mp3","You get a job offer in another city, with better pay. Do you accept the offer?"
"ObjectId(""5fc3ef49660616e15361e143"")",10,"A tap in your bathroom is leaky.","[{""id"":1,""description"":""Get it repaired (will cost ₹200)"",""action"":{""expenditure"":0,""debt"":0,""current"":-200,""events"":[]},""audio"":{""HI"":""event_10_option_1.mp3""},""translation"":{""HI"":""नल को ठीक करवाएं | (₹200 खर्च होंगे)""}},{""id"":2,""description"":""Ignore it"",""action"":{""expenditure"":0,""debt"":0,""current"":0,""events"":[{""id"":15,""probability"":0.3}]},""audio"":{""HI"":""event_10_option_2.mp3""},""translation"":{""HI"":""कुछ न करें|""}}]",0.3,3,"आपके बाथरूम में एक नल टपक रहा है|","event_10.png","event_10.mp3","A tap in your bathroom is leaky."
"ObjectId(""5fc3ef49660616e15361e144"")",9,"You have had a painful backache for a while, but you need to go to work and do not have paid leave. What do you do?","[{""id"":1,""description"":""Take a painkiller and go to work"",""action"":{""expenditure"":0,""debt"":0,""current"":0,""events"":[{""id"":14,""probability"":0.2}]},""audio"":{""HI"":""event_9_option_1.mp3""},""translation"":{""HI"":""दर्द के लिए दवा लें और काम पर जाएं|""}},{""id"":2,""description"":""Visit a doctor (will cost ₹700)"",""action"":{""expenditure"":0,""debt"":0,""current"":-700,""events"":[]},""audio"":{""HI"":""event_9_option_2.mp3""},""translation"":{""HI"":""डॉक्टर के पास जाएं| (₹700 खर्च होंगे)""}}]",0.5,3,"कुछ समय से आपकी पीठ बहुत दर्द कर रही है, लेकिन आपको काम पर जाना है, और आपके पास पेड लीव नहीं है | आप क्या करते हैं?","event_9.png","event_9.mp3","You have had a painful backache for a while, but you need to go to work and do not have paid leave. What do you do?"
"ObjectId(""5fc3ef49660616e15361e145"")",11,"Your brother is getting married. How much do you contribute towards the wedding?","[{""id"":1,""description"":""₹200000"",""action"":{""expenditure"":0,""debt"":0,""current"":-200000,""events"":[]},""audio"":{""HI"":""event_11_option_1.mp3""},""translation"":{""HI"":""₹200000""}},{""id"":2,""description"":""₹300000"",""action"":{""expenditure"":0,""debt"":0,""current"":-300000,""events"":[]},""audio"":{""HI"":""event_11_option_2.mp3""},""translation"":{""HI"":""₹300000""}}]",0.5,3,"आपके भाई की शादी तय हुई है| आप अपनी ओर से शादी पर कितना खर्च करते हैं ?","event_11.png","event_11.mp3","Your brother is getting married. How much do you contribute towards the wedding?"
"ObjectId(""5fc3ef49660616e15361e146"")",13,"Your child has been struggling at school.","[{""id"":1,""description"":""Tutor your child yourself"",""action"":{""expenditure"":0,""debt"":0,""current"":0,""events"":[]},""audio"":{""HI"":""event_13_option_1.mp3""},""translation"":{""HI"":""अपने बच्चे को खुद पढ़ाई में मदद करें""}},{""id"":2,""description"":""Enroll them for after-class tuitions with a nearby teacher/tutor (Will cost ₹1500 per month for a year)"",""action"":{""expenditure"":1500,""debt"":0,""current"":0,""events"":[]},""audio"":{""HI"":""event_13_option_2.mp3""},""translation"":{""HI"":""ट्यूशन टीचर के पास जाएं (हर महीने ₹1500 खर्च होंगे)""}}]",0.5,3,"आपके बच्चे को पढाई में मुश्किल आ रही है","event_13.png","event_13.mp3","Your child has been struggling at school."
"ObjectId(""5fc3ef49660616e15361e147"")",12,"Your child's birthday is coming up, and they ask you for an expensive toy.","[{""id"":1,""description"":""Buy it (will cost ₹2000)"",""action"":{""expenditure"":0,""debt"":0,""current"":-2000,""events"":[]},""audio"":{""HI"":""event_12_option_1.mp3""},""translation"":{""HI"":""उसे खरीदें (₹2000 खर्च होंगे)|""}},{""id"":2,""description"":""Buy them a cheaper toy (will cost ₹500)"",""action"":{""expenditure"":0,""debt"":0,""current"":-500,""events"":[]},""audio"":{""HI"":""event_12_option_2.mp3""},""translation"":{""HI"":""कोई दूसरा खिलौना खरीदें (₹500 खर्च होंगे)|""}}]",0.4,3,"आपके बच्चे का जन्मदिन आ रहा है, और वे आपसे एक महंगा खिलौना मांगते है |","event_12.png","event_12.mp3","Your child's birthday is coming up, and they ask you for an expensive toy."
"ObjectId(""5fc3ef49660616e15361e148"")",14,"Your back gets injured badly and you have to be hospitalized.","[{""id"":1,""description"":""Oh no..."",""action"":{""expenditure"":0,""debt"":0,""current"":-150000,""events"":[]},""audio"":{""HI"":""event_14_option_1.mp3""},""translation"":{""HI"":""अरे नहीं...""}}]",0.4,4,"आपको पीठ में गहरी चोट लग जाती है और अस्पताल में एडमिट होना पड़ेगा","event_14.png","event_14.mp3","Your back gets injured badly and you have to be hospitalized."
"ObjectId(""5fc3ef49660616e15361e149"")",8,"The paint on the walls of your house is peeling off because of leakages.","[{""id"":1,""description"":""Repair the leakages and also get the walls repainted (₹8000)"",""action"":{""expenditure"":0,""debt"":0,""current"":-8000,""events"":[]},""audio"":{""HI"":""event_8_option_1.mp3""},""translation"":{""HI"":""लीकेज को ठीक करवाएं और दीवारों पर पेंट लगाएं|(₹8000 खर्च होंगे)""}},{""id"":2,""description"":""Only repair the leakages (₹500)"",""action"":{""expenditure"":0,""debt"":0,""current"":-500,""events"":[]},""audio"":{""HI"":""event_8_option_2.mp3""},""translation"":{""HI"":""सिर्फ लीकेज को ठीक करवाएं (₹500 खर्च होंगे)""}},{""id"":3,""description"":""Let it be"",""action"":{""expenditure"":0,""debt"":0,""current"":0,""events"":[{""id"":15,""probability"":0.2}]},""audio"":{""HI"":""event_8_option_3.mp3""},""translation"":{""HI"":""कुछ न करें|""}}]",0.8,2,"लीकेज के कारण आपके घर की दीवारों पर लगा पेंट छिल रहा है।","event_8.png","event_8.mp3","The paint on the walls of your house is peeling off because of leakages."
"ObjectId(""5fc3ef49660616e15361e14a"")",15,"The bathroom floor is wet and slippery, which causes your ageing mother to slip and fall. She needs to be hospitalized.","[{""id"":1,""description"":""Oh no..."",""action"":{""expenditure"":0,""debt"":0,""current"":-200000,""events"":[]},""audio"":{""HI"":""event_15_option_1.mp3""},""translation"":{""HI"":""अरे नहीं...""}}]",0.3,4,"बाथरूम का फर्श गीला और फिसलन भरा है, जिसके कारण आपकी बूढ़ी माँ फिसल कर गिर जाती है। उन्हें अस्पताल में एडमिट करने की जरूरत है।","event_15.png","event_15.mp3","The bathroom floor is wet and slippery, which causes your ageing mother to slip and fall. She needs to be hospitalized."
"ObjectId(""5fc3ef49660616e15361e14b"")",16,"Your children's clothes are getting worn out; they need new clothes.","[{""id"":1,""description"":""Buy them new clothes (Will cost ₹4000)"",""action"":{""expenditure"":0,""debt"":0,""current"":-4000,""events"":[]},""audio"":{""HI"":""event_16_option_1.mp3""},""translation"":{""HI"":""उनके लिए नए कपड़े खरीदें (₹4000 खर्च होंगे)""}},{""id"":2,""description"":""Get second-hand clothes"",""action"":{""expenditure"":0,""debt"":0,""current"":0,""events"":[]},""audio"":{""HI"":""event_16_option_2.mp3""},""translation"":{""HI"":""सेकंड-हैंड कपड़े लाएं -- (TODO : कोई बेहतर शब्द?)""}}]",0.6,4,"आपके बच्चों के कपड़े पुराने और खराब हो रहे हैं; उन्हें नए कपड़ों की ज़रूरत है|","event_16.png","event_16.mp3","Your children's clothes are getting worn out; they need new clothes."
"ObjectId(""5fc3ef49660616e15361e14c"")",17,"You fall ill with dengue and have to be hospitalized.","[{""id"":1,""description"":""Oh no..."",""action"":{""expenditure"":0,""debt"":0,""current"":-200000,""events"":[]},""audio"":{""HI"":""event_17_option_1.mp3""},""translation"":{""HI"":""अरे नहीं...""}}]",0.7,4,"आपको डेंगू हो जाता है और अस्पताल में एडमिट होना पड़ेगा |","event_17.png","event_17.mp3","You fall ill with dengue and have to be hospitalized."
"ObjectId(""5fc3ef49660616e15361e14d"")",18,"You receive a call from a person who claims that they're from the bank, and that your account will be frozen unless you provide your bank details.","[{""id"":1,""description"":""You provide your bank details."",""action"":{""expenditure"":0,""debt"":0,""current"":-100000000000,""events"":[]},""audio"":{""HI"":""event_18_option_1.mp3""},""translation"":{""HI"":""उसे बैंक डिटेल्स बता दें""}},{""id"":2,""description"":""You cut the call immediately"",""action"":{""expenditure"":0,""debt"":0,""current"":0,""events"":[]},""audio"":{""HI"":""event_18_option_2.mp3""},""translation"":{""HI"":""तुरंत कॉल काट दें""}}]",0.5,"[1,2,3,4]","आपको किसी व्यक्ति से कॉल आता है जो कहता है कि वह बैंक से है, और अगर आप अपने बैंक डिटेल्स उसे नहीं देंगे, तोह आपका खाता फ़्रीज़ कर दिया जायगा।","event_18.png","event_18.mp3","You receive a call from a person who claims that they're from the bank, and that your account will be frozen unless you provide your bank details."
"ObjectId(""5fc3ef49660616e15361e14e"")",4,"Your family members try to convince you to get married. What do you do?","[{""id"":1,""description"":""Agree to get married (You have to spend Rs 60000 on your part, family members will take care of the rest)"",""action"":{""expenditure"":0,""debt"":0,""current"":-60000,""events"":[]},""audio"":{""HI"":""event_4_option_1.mp3""},""translation"":{""HI"":""शादी करने के लिए सहमत (आपको अपनी ओर से 60000 रुपये खर्च करने होंगे, परिवार के अन्य सदस्य बाकी का खर्च संभालेंगे)""}},{""id"":2,""description"":""Will do it later"",""action"":{""expenditure"":0,""debt"":0,""current"":0,""events"":[{""id"":5,""probability"":1}]},""audio"":{""HI"":""event_4_option_2.mp3""},""translation"":{""HI"":""बाद में करेंगे|""}}]",1,1,"आपके परिवार के सदस्य आपको शादी करने के लिए मनाने की कोशिश करते हैं। आप क्या करते हैं?","event_4.png","event_4.mp3","Your family members try to convince you to get married. What do you do?"
"ObjectId(""5fc3ef49660616e15361e14f"")",22,"Your employer gives you a hefty bonus for Diwali.","[{""id"":1,""description"":""That's great!"",""action"":{""expenditure"":0,""debt"":0,""current"":20000,""events"":[]},""audio"":{""HI"":""event_22_option_1.mp3""},""translation"":{""HI"":""अरे वाह!""}}]",1,3,"आपके एम्प्लायर आपको दिवाली के लिए बहुत अच्छा बोनस देते है|","event_22.png","event_22.mp3","..."
"ObjectId(""5fc3ef49660616e15361e150"")",19,"A group of people from your neighbourhood have been collectively investing their money in a scheme that promises a higher interest rate than schemes available at banks. They ask you to join them. What do you do?","[{""id"":1,""description"":""Accept (Contribute ₹800 per month)"",""action"":{""expenditure"":800,""debt"":0,""current"":0,""events"":[{""id"":20,""probability"":1}]},""audio"":{""HI"":""event_19_option_1.mp3""},""translation"":{""HI"":""उनके साथ शामिल हो जाएं (हर महीने ₹800 देने होंगे )""}},{""id"":2,""description"":""Refuse"",""action"":{""expenditure"":0,""debt"":0,""current"":0,""events"":[]},""audio"":{""HI"":""event_19_option_2.mp3""},""translation"":{""HI"":""मना करें""}}]",0.5,"[2,3,4]","आपके पड़ोस के लोग इकट्ठा होकर एक ऐसी योजना में अपना पैसा लगा रहा है जो बैंकों में उपलब्ध योजनाओं से ज़्यादा ब्याज देती है। वे आपको उनके साथ शामिल होने के लिए कहते हैं। आप क्या करते हैं?","event_19.png","event_19.mp3","A group of people from your neighbourhood have been collectively investing their money in a scheme that promises a higher interest rate than schemes available at banks. They ask you to join them. What do you do?"
"ObjectId(""5fc3ef49660616e15361e151"")",24,"Do you want to enroll for the government's Pradhan Mantri Jeevan Jyoti Bima Yojana scheme? The annual premium is ₹330, the cover amount is ₹2 lakh. The policy needs to be renewed every year.","[{""id"":1,""description"":""Yes (Will cost ₹330 per year)"",""action"":{""expenditure"":27.5,""debt"":0,""current"":0,""events"":[]},""audio"":{""HI"":""event_24_option_1.mp3""},""translation"":{""HI"":""हाँ (हर साल ₹330 भरने है)""}},{""id"":2,""description"":""No"",""action"":{""expenditure"":0,""debt"":0,""current"":0,""events"":[]},""audio"":{""HI"":""event_24_option_2.mp3""},""translation"":{""HI"":""नहीं""}}]",1,1,"क्या आप सरकार की प्रधानमंत्री जीवन ज्योति बीमा योजना के लिए नामांकन करना चाहते हैं? हर साल ₹330 का प्रीमियम भरना है, कवर राशि ₹2 लाख है। पॉलिसी को हर साल रेनू करने की आवश्यकता है।","event_24.png","event_24.mp3","..."
"ObjectId(""5fc3ef49660616e15361e152"")",23,"An accident insurance scheme would help in the unfortunate event of an accident. Do you want to enroll for the government's Pradhan Mantri Suraksha Bima Yojana scheme? The annual premium is ₹12, the cover amount is ₹2 lakh","[{""id"":1,""description"":""Yes (Will cost ₹12 per year)"",""action"":{""expenditure"":1,""debt"":0,""current"":0,""events"":[]},""audio"":{""HI"":""event_23_option_1.mp3""},""translation"":{""HI"":""हाँ (हर साल बारह रुपये ही भरने है)""}},{""id"":2,""description"":""No"",""action"":{""expenditure"":0,""debt"":0,""current"":0,""events"":[]},""audio"":{""HI"":""event_23_option_2.mp3""},""translation"":{""HI"":""नहीं""}}]",1,1,"दुर्घटना बीमा योजना किसी दुर्भाग्यवश दुर्घटना में मदद करेगी। क्या आप सरकार की प्रधानमंत्री सुरक्षा बीमा योजना के लिए नामांकन करना चाहते हैं? वार्षिक प्रीमियम ₹12 है, कवर राशि ₹ 2 लाख है","event_23.png","event_23.mp3","..."
"ObjectId(""5fc3ef49660616e15361e153"")",21,"You have been attacked by a thief! What do you do?","[{""id"":1,""description"":""Hand over money"",""action"":{""expenditure"":0,""debt"":0,""current"":-2000,""events"":[]},""audio"":{""HI"":""event_21_option_1.mp3""},""translation"":{""HI"":""पैसे सौंप दें|""}},{""id"":2,""description"":""Try to fight off or run away"",""action"":{""expenditure"":0,""debt"":0,""current"":0,""events"":[]},""audio"":{""HI"":""event_21_option_2.mp3""},""translation"":{""HI"":""लड़ने या भागने की कोशिश करें|""}}]",0.5,"[1,2,3,4]","आप पर चोर ने हमला किया है! आप क्या करते हैं?","event_21.png","event_21.mp3","You have been attacked by a thief! What do you do?"
"ObjectId(""5fc3ef49660616e15361e154"")",26,"It would be good to buy a life insurance policy. Do you want to buy an LIC policy with an assured sum of ₹ 1 lakh? The monthly premium is ₹500.","[{""id"":1,""description"":""Yes (Will cost ₹500 per month)"",""action"":{""expenditure"":500,""debt"":0,""current"":0,""events"":[]},""audio"":{""HI"":""event_26_option_1.mp3""},""translation"":{""HI"":""हाँ (हर महीने ₹500 भरने है)""}},{""id"":2,""description"":""No"",""action"":{""expenditure"":0,""debt"":0,""current"":0,""events"":[]},""audio"":{""HI"":""event_26_option_2.mp3""},""translation"":{""HI"":""नहीं""}}]",1,1,"जीवन बीमा पॉलिसी खरीदना अच्छा होगा। क्या आप ₹ 1 लाख की सुनिश्चित राशि वाली LIC पॉलिसी खरीदना चाहते हैं? मासिक प्रीमियम ₹ 500 है।","event_26.png","event_26.mp3","..."
"ObjectId(""5fc3ef49660616e15361e155"")",20,"The neighbourhood scheme was a fraud, you lose all the money which you had invested.","[{""id"":1,""description"":""Oh no..."",""action"":{""expenditure"":0,""debt"":0,""current"":-10000,""events"":[]},""audio"":{""HI"":""event_20_option_1.mp3""},""translation"":{""HI"":""अरे नहीं...""}}]",0,"[2,3,4]","पड़ोसियों वाली योजना एक धोखा निकली, आपने जो भी पैसा लगाया था वह सारा पैसा खो दिया।","event_20.png","event_20.mp3","The neighbourhood scheme was a fraud, you lose all the money which you had invested."
"ObjectId(""5fc3ef49660616e15361e156"")",25,"Do you want to buy a health insurance policy?","[{""id"":1,""description"":""Yes, buy an individual plan whose annual premium is ₹5000, and the cover amount is ₹2 lakh"",""action"":{""expenditure"":416.66,""debt"":0,""current"":0,""events"":[]},""audio"":{""HI"":""event_25_option_1.mp3""},""translation"":{""HI"":""हां, एक व्यक्तिगत योजना खरीदें, जिसमे हर साल ₹5000 का प्रीमियम भरना है, और कवर राशि ₹2 लाख है|""}},{""id"":2,""description"":""Yes, buy a family plan whose annual premium is ₹6000, the cover amount is ₹3 lakh, and it includes your spouse and children"",""action"":{""expenditure"":500,""debt"":0,""current"":0,""events"":[]},""audio"":{""HI"":""event_25_option_2.mp3""},""translation"":{""HI"":""हां, एक पारिवारिक योजना खरीदें, जिसमे हर साल ₹6000 का प्रीमियम भरना है, कवर राशि ₹3 लाख है, और इसमें आपके पति या पत्नी और बच्चे शामिल हैं|""}},{""id"":3,""description"":""Yes, buy a family plan whose annual premium is ₹10000, the cover amount is ₹3 lakh, and it includes your parents, spouse and children"",""action"":{""expenditure"":833.33,""debt"":0,""current"":0,""events"":[]},""audio"":{""HI"":""event_25_option_3.mp3""},""translation"":{""HI"":""हां, एक पारिवारिक योजना खरीदें, जिसमे हर साल ₹10000 का प्रीमियम भरना है, कवर राशि ₹3 लाख है, और इसमें आपके माता-पिता, पति या पत्नी और बच्चे शामिल हैं|""}},{""id"":4,""description"":""No, don't want to buy a health insurance policy"",""action"":{""expenditure"":0,""debt"":0,""current"":0,""events"":[]},""audio"":{""HI"":""event_25_option_4.mp3""},""translation"":{""HI"":""नहीं, स्वास्थ्य बीमा पॉलिसी नहीं खरीदना चाहते|""}}]",1,2,"क्या आप स्वास्थ्य बीमा पॉलिसी खरीदना चाहेंगे?","event_25.png","event_25.mp3","..."
